"recently , service dreadful length time take get simple pepperoni pizza breadstick could early 45 minute place empty far refill , forget ."
"n't know pizza hut could get medium cheese pepperoni pizza wrong , twice 3 time ! ! !"
go store order cheese pepperoni pizza cashier say would ready 15 minute .
"another 15 minute later cook ask cashier order say `` oops make wrong thing , make half cheese olive , start order `` hour later 3rd attempt simple pizza , finally get cheese pepperoni ."
order large supreme without pepperoni .
"hi yelpers , n't pizza hut year finally today 3/6/20 decide get large pie pineapple , large pie pepperoni order 12 honey bqe bone chicken wing ."
"food give us pretty quickly 'm always concern since pizza box hot keep go home , get home cheese pizza dry , pineapple minimal , look taste old like reheat wait even order go pepperoni pizza ."
"specifically order without pepperoni , is.so , okay , 're eager put extra stuff n't want take ?"
& friend come one pizza hut pepperoni pizza ok ...
get 5 $ deal go order hand toss pepperoni pineapple pizza bbq medium buffalo wing .
arrive pick dinner box 2 medium pepperoni pie .
"make pizza whatever topping want , like pepperoni mushroom ."
seriously think one time spoil pepperoni pizza sour smelling & tasting .
