1,1,3,"Though Lori L. Yan T. apt believe , I check accident look direction location ; I woman , therefore , need restroom time , STAT.I say , however , interior extremely well-maintained . Dare I even say 's `` pretty `` ? I use restroom , I knock , hear answer three second later , enter , two gentleman say bathroom . One leave zip pant . He matter factly inform friend way , I could go use toilet I need to.I ... waited.Next time , I 'll buy small order fry combat `` I use 'customers ' bathroom without pay `` guilt . ... story . I hope enjoy ."
2,2,2,"I 've lot restaurant absolute worst . From staff hairnet straggle hair everywhere overflow trash greet soon come , place need condemn . It 's disgust . The worker say bathroom order yet sign state . The worker say someone keep take unlock restroom use anything look like `` American Horror Story : McDonald 's `` . They bunch staff back yet one seem clean bathroom surround area since night . It deplorable . And audacity smart sell yesterday 's apple pie ! That thing hard economy ! The health department need ASAP ! And worker lazy hell ."
6,2,2,With doubt bad run Mackers Iv ever . No one care people look/act like manager useless rest . They seem almost proud lack care ! And struggle simplest order
7,1,1,"Management change , make effort . Naomi take care fry real good ."
9,2,2,Worst McDonald 's ever ! Staff hang around cell phone talk . Never ! !
10,2,2,"SUCH bad service . It 's McDonald 's food expect McDonald 's I 've , bad service I 've see suck since one I live close to.The interior pretty clean look nice , would make rating decent rude af cashier . This n't limit single instance ; I multiple time cashier almost always incredible offensive , rush call stupid blind ask clarification menu drinks.Furthermore , store always seem . The ice cream machine almost constantly break one memorable time , I try buy drink almost everything ( lead ask exactly cashier call blind , mention ) . There another time cashier yell old man struggle order . Yep , make opinion place go wayyy down.P.S . n't try use McDonald 's app coupon place ; cashier wo n't wait show bar code manage scan , give really judgey look ."
11,2,2,Horrible cold food half cooked fry 's expensive cold crap sell
12,2,2,Ummm ... yeaaaaah place horrible employee always attitude hell attitude work ? Just QUIT ! ! ! I never understand people come work like bad day everyday I n't get . A NEW STAFF IS NEEDED !
13,2,3,"Oh pity . I mean , I lucky McDonald 's block away I live . Lots memory child go happy place . Too bad memory fade especially McDonald 's like . First , I give 2 star base food . I 've never problem 6 year 's open food . It 's little annoyance around food irk core . This place attract sick people . Literally . The hospital block 's also methodone clinic close . Having patient action around lead pathogens table chair counter . Not mention nod happen a.m . This McDonald 's also close train station attract many people work . Mornings bad . Long line 1 2 register open . Unwelcoming . People take order fulfil different time . Still frozen hash brown . Nodding individual . What Coffee Only line . Take note . Not mention LOUD screeching/scratching chair get pull table . The noise almost deafening bad endure 7 , 8 , 9 a.m. anytime day really . Then deal lingering middle schoolers lunch break neighbor employee . Even long line still 2 register open . And later evening expect chaos kid wo n't go home school , stick around curse laugh storm . As well Chinatown crowd still shock closing Canal Street 's location . Be prepare possible panhadlers well . They come . The bathroom well-maintained though . A certain lady year since I live relatively close , I 'd stick . What place need enema . An intervention Gods sift , cease , refine . Again , food great . It 's McDonald 's , know expect . But location put 's ambiance back burner 's McDonald 's I want continue know . Good Luck !"
14,2,2,"When McDonalds first open clean always pack customer . Tonight I order filet-o-fish meal cost $ 8 time I get home ( literally block ) food cold . Not , I put toaster oven heat little cheese n't even melt ! mention fish hard . There 3 employee plus Mgr .. one prepping food . Service slow skip order 3 time . Health department need pay visit even .. SHUT IT DOWN ! ! ! ! In morning/afternoon hour place fill addict . Some eat hang . I 've say time I mean . I 'll never order eat food ...."
15,1,1,"Every month I get McDonald 's craving . Just come quick fix . The fry perfectly cook really , 's important craving satisfy . The filet-o-fish party small I remember I think 's corporate problem particular franchise . Management staff operate efficiently busy lunch hour wait 5 min food . One good location I 've ."
16,2,2,"Place dirty , customer service non existence , bad food , slow service , list go .. You get idea . It 's dump overall .. Stay away ."
17,2,2,This place bad service cashier always attitude . Always give dirty look .
19,1,3,Ca n't find fault visit . Service good ; long wait . The place kept clean . And burger ( new bacon club ) even come look like picture . That hardly ever happen !
18,2,2,The food horrible . It bad McDonald 's stores.The bread use always stale . The service lousy .. The management rude .
20,2,2,"would give 0 star could . ige alot mickey bad forget bad service im ny deal . let talk hashbrown throw bag wrapper , chicken nugget get piece hard white plastic ? ? ! ! wtf 's like hard high expectation mcdonald 's least usually 's edible gross seemingly unsanitary . place need serious help jesus ."
21,1,1,Needed breakfast work 6am 2pm shift . And mood sausage egg mc muffin . I n't McDonald 's year . So I order mc muffin hash browns.Order come fast way . I choice breakfast nearby could n't deny mickie craving .
22,2,2,"Not frequent McDonald 's visitor , I n't one year . This McDonald 's PACKED . The seating restroom second floor , get stair like swim current . The hallway space way small worker unfriendly , bust way first.Food anywhere else , main reasoning behind review atmosphere ."
23,2,2,"Worst I 've . The staff rude listen , unapologetically take order attitude . The place filthy . Garbage everywhere . The food old I mad I take go I trust would fresh , sure . My fry , even ask salt , make fresh . The expensive borough fillet fish old taste like sit . The manger seem work seem clean table dirty rag smell like old dirty mop ."
24,2,2,The McDonald 's total scam . Do n't visit . Outside advertise student discount I never get even student ID . Then I give lady $ 15 $ 14 order say I give $ 14 . I appalled ca n't math correctly . Either ca n't math want steal $ 1 . She n't give back change even though I demand . I even tell check security camera . She keep insist I give $ 14 . That 's disgusting . She also give burn chicken nugget . Seriously place scam total waste time money .
25,2,2,"This McDonald 's 52 Fulton Street , NYC close . The sign front door say could n't afford new rent increase ."
26,2,2,Just walk right . This store 24 hour serve customer I get reject say close . If store `` closed `` lock door change dining hour .
27,2,2,"I come lunch break work - meaning I already short time give place call `` fast food `` course , I expect FAST service . That last thing I get top problem I encounter . It safe say I probably wo n't visit location anytime soon food good ( reason 2-star rating 1-star ) customer service repulsive.I visit 12:30PM since lunch hour everywhere , expect fully staff McDonalds work register . They hold line argue another customer preferred choice payment ! ! ! Not money pay one thing choose pay cash exact change another end day , money money.They end take ( finally ) keep move . After 15 minute wait line order another 10 minute get food , lunch break I eat burger walk back work ."
28,2,2,"`` No packet mayonnaise relish `` ( Lies ) Shitty overprice McDonalds near Wall Street . Bad food , high price . Walk 0.5 mile anywhere good food.Assholes know neighborhood ball late-night eats . Overcharge undersupply ."
29,2,2,"After long night watch Michigan sport ( WOLVERINES ! ) I really want McFlurry . The person behind counter say machine broke , people eat soft serve I think lie ."
30,2,2,Do favor ..... 're like love Brummer king fast food every blue moon NEVER walk location . It 's street one day I decide 4 minute walk instead order . The staff disgustingly rude . The place visibly dirty . I regret . It may ruin Burger King together . Let alone month cheat meal . I n't get .... I think fast food employee pay $ 15 hour .... n't care little ? I know ... 's Burger King I n't expect much .
31,2,2,I come quick hot chocolate interview . There line service slow rude . There bunch people loiter make hard get seat . I able grab seat enjoy rest beverage I wipe filthy .
32,2,2,"Wtf ? ? ? I work around corner attempt order several time . A ) never , NEVER AHAVE McFlurrys . B ) I ca n't eat pork red meat . Every time I ask hash brown , instead sausage , EVERY OTHER MCDONALDS say yes . This place wo n't accommodate people n't eat sausage . As earlier state , I work around corner . This place would legit get business minimum two time week , n't AWFUL customer service ."
33,2,2,This McDonald 's worst even I love fast food get order wrong call obese father fat turning
34,2,2,Unfortunately All employee idiots.They say $ 5 $ 4.79 . They could understand $ 0.21 difference .
35,2,2,"The absolute worst McDonald 's existence . Slowest service , stale/poorly cook food probably low low staff . I avoid place like plague time ."
37,2,2,"Visited Thurs , 5/3/18 around 4:45pm : bad experience first time fast food restaurant . The front counter lady attend order serious attitude problem towards CUSTOMER , way , I Chinese . I hope racial issue . I n't know ask question could offensive show effort offer help clarification answer query . On hand , act arrogant throughout transaction . I wonder someone complain lady . Looks like staff need in-depth-training require awareness FUNDAMENTAL CUSTOMER SERVICE order maintain good reputation McDonald 's ."
38,2,2,"I ca n't really avoid place I need fast food fix , since 's McDonald 's close , service constant product malfunction real turn . I 've location 4 time every single time something wrong.1 . The payment processing machine break n't accept card time . ( okay happen ) 2 . They n't serve McFlurries , Shakes , Ice cream , apple pie , desserts.3 . They take 30 minute make batch french fries.4 . All seat area cover trash half eaten food.I mean , I 'm sure much due manager restaurant failure supply chain logistics , restaurant never serve full menu ?"
39,2,2,"They absolutely horrible service bad I 've ever see . The food take forever get ridiculous I 'll slow take , take like 20 minute . It like know nothing ."
40,3,1,Cool stuff hamburger guy texting latex glove still . The bread stale fry surprisingly delectable . The owner McDonald 's really need surprise visit refresher hamburger university .
41,3,3,"It 's hit miss . Sometimes staff actually care enough make food quickly sometimes could care less . Also , crowd get weird I ca n't really blame McDonalds lol . Long 's many people wait food already inside good shot get decent service . It 's mcdonalds , whatever I 'll back anyways ."
43,3,3,The lunch crunch n't bad . Very short wait Shamrock shake
42,2,2,"This get disgusting McDonald 's I ever patronize ! I go visit husband Columbia Presbyterian surgery request fry late night . We end toss half order ! The food cold stale like sit hour . My burger taste like old oil fry limp , cold dry . Too bad order go I would argue damn refund ! I wonder I get order fast late night . What horror ! I never ... Repeat never ... Eat ! The cashier carry conversation look like I steal puppy I stand wait serve . You also deal homeless people harass money open door . ( Nothing I 'm hungry ! ) My hubby I swear go boycott McDonald 's one neighborhood fall completely ( despite remodel ) . I satisfy late night craving elsewhere ."
44,2,2,"I use come year ago still come day . The place clean lot wasted space even pre covid . Right I 'm surprised n't instal kiosk line place order pickup order slow . The advertise use McDonald 's app get deal free delivery deal work pickup free delivery n't free , delivery open ubereats finish order ubereats ."
46,1,1,It always take back place I remember I concentrate fun ( winter sport ) . I love breakfast menu . And price reasonable especially pandemic.Their hash brown n't change bit . And 's I like .
45,1,1,It 's McDonald 's I mean 're get food time 's cold 're good shape . Has work covid guideline pretty fast . Works well app .
48,2,2,"Avoid place night , crime central , mentally ill , homeless . Police call regularly ."
49,1,1,"I impress offer sale deal McDonald location Brooklyn . From previous experience many NOT sale . Plus , date Art store- beautiful . The service pleasant order take time . Of course , coffee way I request , I able fix . Fresh pot keep silent . I 'll probably revisit due close job fast service . I 'm sure lunch special . Clean , fast service , clean restroom I 'm happy helper"
50,2,2,"This McDonald 's weird.The line unorganized feel little bit like madhouse . Maybe 's random lady dancing like 's seizure middle store eye half close roll back . You know 's dance though voodoo-seizure dance beat song 're play . Maybe 's creepy dude stand corner talk half yelling customer . It n't help 's kind dark add creepy mood . To top , I brave crazy fry -- pip hot fry limp . Go crazy food ."
51,1,1,"I location time New York City trip . My visit mostly midnight hour , I visit couple time midnight . I find McDonald 's location rank top half list fast food restaurant Manhattan.This location unique McDonald 's Manhattan interior design . First , inside two floor , convenient , consider high traffic area . This make feel less overwhelmed customer rush food , like couple McDonald 's Manhattan . The after-midnight hour less chaotic . Second , painting photo part Manhattan give inside interesting flare . These include park , building , street sign . I never expect McDonald 's artsy feel . This refresh McDonald 's I frequent feel bland . This McDonald 's not.The employee seem maintain appearance well . The inside look clean after-midnight hour time . I expect inside look sparkle clean high level traffic . However , even time , leftover food particle leave behind previous customer never felt excessive . Therefore , I always felt comfortable walking dining here.The employee consistently friendly . I see friendliness patron I observe . They also seem carry well busy hour . They always quick patient customer . This great quality , consider Manhattan fast food restaurant consistency customer service . I deduct one star sometimes , wait time food excessive . I understand high level traffic also want food , I see long wait slow time also . This could use improving . Otherwise , food always come hot fresh , taste delicious . I usually order cheeseburger quarter pounder meal . I satisfy both.When I part Manhattan mood quick bite eat , I continue keep location mind . I likely continue favor after-midnight hour time day . I feel like I receive best overall service ."
52,1,1,"I love come long tiring day , I grab quick snack . The location pretty unique bit different MANY Mcdonalds I 've . I think employee able keep good environment able keep nice . The food like every Mcdonalds I 've nothing different nothing special . I appreciate service serve name , `` fast food `` . Overall , 's good place get quick snack tire day work !"
53,2,3,"I rarely eat McDonalds fast food first . Things annoy particular location - homeless point day try open door beg tip get angry n't tip open door . I n't even go eat notice go I 'm walk around lunch break . I come friend day cheap I n't feel like google food $ 10 area . I opt naturally happy meal totally change since I kid . Or even 8 9 year ago . First , happy meal $ 1/2/3 menu . It come like $ 4 - cry river . Holy * hit kid 's sized fry like . . . . I n't even word I dumbfounded . I think I get like 4 french fry cardboard box . Cheeseburger - two thumb . I order eff Little Bo Peep toy go aside rot shelf till I give kid ? Option side apple go-gurt . What ? After daze confuse new addition , I obviously go gogurt I get unnatural tasting brown apple homeless people open door . Maybe , complaint McDonalds . I confuse soft beverage option I 'm use soda fountain open pour give regular coke without ask I want . I n't like soda . Would nice know drink option . Four-year old lament everywhere . The sauce also n't leave . But I think McDonalds away year ago . There 's nothing devastate I ca n't get extra ketchup packet ranch sweet sour sauce without judge criminal . The exciting part meal toy Stroopwafel McFlurry . Sweet jesus . So new mcflurry shamrock shake pretty much reason I want go McDonalds record . But one magical thing I 've put mouth since Rollo McFlurry . Please love god bring back , Mickey D 's . Okay , interesting conversation Bradley Cooper Lady Gaga Tonya Harding possibly another homeless man , I try friend 's bacon cheese fry . Two thumb . The portion size ridiculously small . Some people n't problem obesity America . This make really quite sad . The cheese sauce kind tasted surprisingly good bacon taste like bacon bit get jar . I n't think I 'd add bacon anything period . Overall , get job . I felt uncomfortable weirdly full tiny meal also make question hell I 'm eat . Anyway , I 've much good location . Even Union Square good job crowd control hub ."
54,2,2,"McDonald 's us cruel practice chicken . This ' happy meal ' . These chicken keep battery cage even allow walk due amount growth hormone feed . They abused disgustingly . If want read McDonald 's cruel practice , look site : foodrevolution.org/blog/… imnotlovinit.com"
55,2,3,"The front door McDonald 's control aggressive vagrant , act place . They open close door , look tips.This borderline threatening practice , n't surprise incident . The vagrant friendly term employee come go , , amazingly , look thought practice condone ."
56,2,2,Do n't even bother come . They serve fry 1 AM later . They n't even help us give us want . We n't people restaurant try order food . Very poor management .
58,2,2,Do n't expect much McDonald 's term service even food option . Only expect cook ... food . Long story short .
59,2,2,"Construction sidewalk , rude employee . I ask BBQ Sauce nugget guy hand one . Really ? I ask I say thanks I get ignore . If n't like job stay school get another one ."
60,2,2,Terrible service . Employees greet speak costumer . Open 24 hour every time I 've nothing ready . Manager n't even greet costumer let know go . I stand register 20 minute anyone say anything . Ended leave breakfast work .
61,2,3,"Since I go school near McDonald 's , I 've visit quite often . I never issue since 're typically decent mood ice cream machine always work . However , week ago , I go alone grab quick bite , wait meal , one manager start compliment . I earphone I smile awkwardly say `` thank `` , hop 'd take hint . I sit one table , 15 minute , come twice keep flirting . Each time , I keep earphone , awkwardly giggle keep eat . However , uncomfortable experience , I 'm eat McDonald 's - alone least . I rather take 10-minute​ walk nearby McDonald 's 's actually nice one make feel uncomfortable ."
62,2,2,I use mcdonalds app place mobile order I go restaurant pick `` could n't find `` order system refuse give food refund .
63,2,2,Horrible service . The manager walk around AirPods disrespectful hit woman ... completely unacceptable ...
64,1,1,A VERY BUSY McDsThey fast ! A well run store busy part city.I diet I order make without mayo etc come quick hassle
65,2,3,"There n't single table available . What happen good manner from.the customer . I recently come back great state Louisiana woman , would always man willing give seat . Not establishment . My feeling hurt"
66,1,1,"I 'd go nearby McD 's spacious ; two floor . Good place stop walk around FiDi , WTC , Wall Street , etc.They large TV display order 're fulfil , first me.Note miss DJ play , mention review ."
67,2,2,"They charge McChicken $ 2.49 usually sell $ 1 McDonald . When I ask $ 2.49 , say price location . It rip-off ."
68,2,2,Nasty Management . I place mobile order . When go pick realize sandwich order wasnt bag . It dry hamburger stead . When manager wa ask assist order become nasty disrespectful . I tell customer respect respectful become event line . I tell cancel order didnt want anything McDonalds . Nasty disrespectful !
69,2,2,"I feel bad people work . There clearly poor management . Tonight person register also make drink two people bag food also make . I mobile order 2 Iced tea , I 've wait half hour ."
71,1,3,No option area breakfast except Pret A Manger . Hubby want something basic end . Clean establishment friendly worker . The space 2 level plenty sit option . It serve purpose morning pick .
72,3,3,This McDonalds TV show downtown . A bit pimp usually quite bum front . Service adequate hash brown perfectly cook . Bathroom gross .
73,2,1,Took 27 minute get bacon buffalo crispy chicken cold sandwich holder type salf fry .
74,3,2,I frequent restaurant lot one near seaport lot clean update ... place need renovation . The food taste like McDonald 's . They slow night . Oh I say need CLEANED UP .
75,2,2,This median fry ? ! And ketchup always dirty .... ! I wish I give McDonal-1 star !
76,1,1,"This place get 4 star base comparison OTHER McDonald 's . It 's standard fare , place like dress , fancy version ! With live music ! Pretty funny random . It 's also open 24/7 . Last time I walk look like close renovation . I hope make even grander ! hahaha ."
77,2,2,"Just touristy me.I always get uneasy feeling I walk McDonalds , recently , noise McCafe blender loud Jet Engine.No lie , I could n't hear counter person decibel level thing . I 've McDonalds McCafe set , none loud . Change thing ! It 's disturb annoy ."
78,2,3,terrible busy . small restroom . Do go prevent it.Bathroom line take much long food .
79,1,1,"Great food service well . The counter help fast swift take order , behind scene people make come together minute ."
80,3,3,"For McDonald 's , pretty nice one.Yes Fancy McDonald 's I 've see feature Food Network Travel Channel.I bit worried I read yelp review n't mention piano player waiter service.On 12/5/2010 , I take boo check Museum American Indian . I want cheap date , golden arch destination itinerary . However , bit price range . Everything 30 % expensive McDonalds I 've see . A small hot chocolate $ 2.40 ! Did inflation go fast sleep ? We decline eat Disneyworld style pricing sit warm head Chinatown.Things note case want know still Fancy McDonald 's : There doormanThere table serviceThere piano play lady upstairsThe employee wear fancy hat uniformsThe price match ambienceThe ketchup packet lay kinda fancy display use vs bin"
81,2,2,Yeah far bad McDonald 's I 've ever life . Wait 20 min line say cash instead sign say I would n't wait line would know leave . Says 20 min fix system take 25 min . Waited almost hr 2 mcmuffins . While wait store allow crack guy walk around talk bug another person dope pass box Dunkin donut next guy come coke drink coffee staring everyone . Then eat homeless drug addict come asks buy food string . I n't obviously friend fell shit . Then I 'm leave crackhead guy bum cigarette n't want offend crackhead bug give one . Never go . Place suck fat chod ! ! !
82,2,2,"No outlet upstairs , bathroom downstairs restrict handicapped individual , upstairs pack refuse open remain 75 % seating available . What 's point restrict seating force people stand 10 table available ? Guys restroom one urinal line . Overall poor setup reflect want people buy food leave ."
83,1,3,"I never think I would review McDonalds . 5 star service ! I real terrible one service sux , others would charge additional sauce . The hiring manager must good eye ear ratchet candidates- every worker really nice . 5 star"
84,2,3,McDonald 's McDonald 's really place unique difference live person play music piano restaurant . What I really n't like location seat terrible ( least I visit ) . They 2 floor seat maybe dozen seat floor area massive tourism seating non-existent I visit .
85,1,2,"Yes , I review McDonald 's .. stop judgment ! I come basically every morning iced coffee n't many alternative along way office iced coffee cafeteria bite big one . The line long , move pretty quickly . Large ice coffee yogurt parfait $ 5 ? Do n't mind I ! My qualm may slightly irrelevant , I would like complain nevertheless . There ridiculous `` homeless `` guy sit outside last 2 month - look pretty clean I 've notice New Balances change twice .. n't seem poor , sir . Also , seem punctual enough every morning show outside Micky D 's extra cashola , go get job .. kthx ."
86,1,2,"When I work downtown , part I would eat lunch . For , place see . You get stock ticker work , since Wall Street right . You get Mickey D 's version Liberace , play heart 's content 're Royale Cheese ( Liberace never find wife support I never know . Same go RIchard Simmons ) . You even get McDonald 's Gift Shop second floor ( yes , McDonald 's multiple floor ) buy mini-Statue Liberty McDonald 's logo . Better yet , cheapskate , Dollar Menu full effect . I 'm Loving ( especially 's dollar ) ."
88,1,1,This place amazing one kind.There woman play piano singing . The staff wear cool french style hat . Everyone nice . Check upstairs ! A must see Mcds area !
89,2,2,Went today . There fry & n't even try ! What 's good renovation 's fry ? Gon na go one Fulton instead
91,1,1,This mcdonalds super busy get live pianoist perform upstair rest tired foot shop Century 21 . Another good thing place free restroom girl boy move ten time faster starbucks restroom . Totally recommend place area = )
