265,2,2,Disgusting place . Homeless people sleep overnight concern especially consider hygiene place kitchen . This branch shut . Would never come eat .
266,2,2,"If want eat , expect slow service frequent mistake order . I know I n't expect much fast food , neither . Only eat last resort ."
267,2,3,"This place look pretty , remodel . Do n't let pretty face fool you.I wait ten minute two McMuffins crew kitchen chat loudly other.The table filthy.Coffee lukewarm.And , Self-Order kiosk n't work right.I live neighborhood , pretty typical location . Anyway , crazy thing : My receipt say restaurant manager Jesus . Now , 's get lot plate . But , 're ask endless fish , all-you-can-drink water-into-wine , even heal crazy homeless people walk around mutter - hot coffee , clean table , `` fast `` part `` fast food . `` What take , miracle ? Anyway review , like peace-out I 'll go elsewhere ."
268,1,1,"So I come gym late night workout hunt place still open business 11 PM . This part Lower Manhattan way Battery Park shut early , normal work hour place like ghost town . The bright light Golden Arches shone like beacon night sky.I usual breakfast dinner routine order 2 Sausage Egg & Cheese McMuffins . Simple , fast , hit spot ."
269,2,2,"The service get bad & bad . Last week I order 4 piece nugget wait 20 min . It n't even busy . There two customer include . It late , employee busy talk record snapchat videos line . I come class today get coffee , 30 min class . I exam today . Waited 45 minuet . I ask three time finally get . I understand 's busy employee take sweet time everything . The staff rude . And 've come often past three year . But today , I 'm never return location ."
270,3,3,"While mcd clean others , seem `` good `` mcds area . But constant losing order via kioses . Then finally get order 10-30 min later .... find modify fry accept less fry .... I mean n't new ... least 3 year ."
271,2,2,"Possibly bad McDonald 's anywhere . The staff blatantly care . The service slow . The food always cold . I 'm place last night wait nearly 15 minute order fry ( crazy pregnancy craving , 's I eat keep ! ) order leave call stone cold time I eventually get . I haul ( baby bump ) McDonald 's closest one avoid TriBeCa location future ."
272,2,2,Another crazy experience lunch . The manager need train staff way well . Customer service non-existent . From cashier yelling customer move one side lady scream pick order number . Not loud obnoxious ; 's rude fussing customer take seat pick order . I never experience McDonald 's like .. quite disturb .
273,2,2,This flagship McDonalds ... stingy fry ? ! And hot ? ! This Mickey D 's suppose pinnacle McDonalds always short change french fry Air Conditioning seem totally nonexistent . I dont know worker deal .
274,2,3,"SS try buy McDonald 's breakfast take mad long . He come 10:00AM SHARP serve close 11:00AM . Such disappointment . Although , try make right offer extra free food item deny . He leave McDonald 's limo . He 's come ever suggest . It 's time run business . Jesus manager please change way ."
275,1,1,This place always drowsy positive side order machine . So n't need stand big line . You get fast service . Staffs friendly . Food fresh . Air condition good . Always perfect environment . Enough table . You meal enjoy view time . I recommend place .
276,2,2,No ac customer service garbage . The cashier busy talk someone FaceTime job .
277,2,2,"This bad place ever ! ! They seriously need get sh * together might well shut . I go 2 day ago family . We order new tomato melt mozzarella burger . When get mozzarella , cold ice think oh well 's easy fix . When get back lady make throw cold piece mozzarella melt . Then go back kid behind register tell us never melt cheese burger want could microwave us . Microwave ? ? ? ? Are serious ? Then wait rest order kid register literally phone texting pay attention customer . He n't even say hi anything . And cousin order hand receipt look phone even look him.This place need serious check new staff would great !"
278,2,2,"If ca n't bring food table order kiosk , n't offer service . I order sundae I go counter sundae melt . Awful ..."
280,2,2,"This McDonald 's horrible . Terrible customer service , unable get order time . Can multitask . Do take job seriously . Unfit make order correct many customer ."
281,2,2,Slow bad service . Spent 20 minute wait 2 Big Macs . Would give 0 star I could .
282,2,3,"I complaint particular establishment . First , enough seat consider fact near four school . Whenever I come visit especially dismissal time ( around 3-4 ) massive number student hang around , stand eat food . The service ok , sometimes cashier extremely rude , I understand amount stress . The food alright consider price point , different McDonald 's I visit past . The entire environment extremely unsanitary , dirty floor table . Do even get start restroom , I would rather urinate pant use facility . Overall , I give establishment 2/10 . There aspect guy definitely improve I hope comment others help create guideline make good environment customer ."
283,2,2,"Never last 50 year I wait 45 min kid meal McDonald 's world . And people work seem got use many customer complain worker emotion . Manager employee absolutely sense urgency serve . They lucky still business location . I ca n't say enough bad thing . Negative star , avoid cost ."
284,2,2,Not sure place day night suck . I work night rare occasion come get snack . It bad . The food taste like leave time . They always play loud spanish music obnoxious fill order . On top usually fill homeless people sleep beg change . Stay away .
285,2,2,"Dirty floor . And slow service . This suppose fast food . If go , check order , seem leave stuff ."
286,2,2,This McDonald 's never clean . The staff n't care dining area . They come back end serve food customer . Tables never clean thoroughly . It 's homeless people live back bathroom . The soda machine stay sticky . Never proper uniform . One person wear white shirt even uniform . All people need retrain . And I think manager go call McDonalds University training purpose . Yea ok . I would rate 1.0 % 100 % . By way . I e never see General Manager McDonald 's .
287,2,2,"I never think I 'd write review McDonald 's place ridiculous . Yeah , kiosk cool , kind pointless wait 15 minute food ."
288,2,1,"Huh ? How ice cream machine ? ! ? ? ! That mean shake , ice cream cone , sundae . This pregnant woman happy . ( Man behind counter n't show much remorse . ) And frappe ca n't decaf coffee . Bah !"
289,2,2,Horrible ! ! ! Waited long food . Zero star . Terrible management . No clue customer service . Food bring piece meal . Fries cold . Sandwich cold . No apology . No consideration . Complaints manager address blank stare . We ask refund . A good manager would refund partial bill apologise profusely . This manager throw food offer nothing time waste frustration suffer .
290,3,3,Decent Mcdonalds . I wouldnt say 's anything special . Open 24 hour . Reason I give 3 star cleanliness place .
291,1,1,"Really surprise bad review . This one best one city , IMO . Very clean , spacious , comfortable seating . Everything make fresh order , self kiosk machine order food , . Never issue ."
293,3,3,Clean great location . But slow agonizing wait fast food joint . Not impressed . .does n't mean I wo n't back fill belly .
294,2,2,"It 's 10:26 . Customer : Are serve breakfast ? The McDonald 's worker : No , stop serve breakfast 10:30 . Customer : It 's 10:30 . It 's 10:26 . The McDonald 's worker : Then stop serve breakfast 10:26. ? ! ? ! ? ! ? ! ? ! ? !"
297,2,2,"One star open 24 hour another one clean close apartment ... This review actually new Angus burger , I try bacon/cheese option could chew two bite .... Terrible , word Angus good marketing get deliver.I stay away fast food least another year experience"
299,1,1,McDonalds # 11163 great service employee . Excellent manager Carlos helpful kind . Customers definitely positive experience McD location .
300,1,1,Everything delivery perfectly package still warm surprise chocolate chip cookie include
301,2,2,Pretty standard McDonald 's make sure item leave ! Had go back twice miss item bag
302,2,2,"The lazy , incompetent employee . Ordered Double Big Mac . The idiot compile sandwich ingredient throw everything haphazardly low half burger place middle bread underneath top bun . Put minuscule amount sauce lettuce . Will go back ."
303,2,2,"Twice , restaurant serve rotten egg McGriddle ! Absolutely disgust , show employee clearly n't care poison customer ."
304,2,2,"The disgusting McDonald 's I 've ever . The worker lazy , rude act like bother . The food always cold thrown together fresh ."
306,2,2,Extremely unsafe McDonald 's . Had visit several time past year early evening - lot loiter outside aggressive individual . Many homeless sleep inside restaurant others aggressively panhandle customer inside & outside . Last night someone shoot dead outside McDonald 's around 10pm . Do visit value safety .
309,2,2,"I recently go McDonald 's 395 Flatbush Avenue , I saw people wait long time , order place via mobile 1124 pm put way I walk McDonald 's 1215 without food , manager sherry idea manage thing get busy , unprofessional fall pressure.this last time go McDonald 's I think Ronald McDonald clown look like bunch clown work establishment I repeat n't ever come McDonald 's"
307,2,2,Bad service fry always undercooked . They n't acknowledge care give good experience .
310,2,3,Today . True Story.-I walk immediately regret decision local high school let . Mistake # 1 . -I weave crowd well cry child ask free small coffee `` National Coffee Day `` ( per news source ) woman say `` NOPE . NOT TODAY . `` ........ K.-I order co-worker 's Ice Cream Sundae want number call lady come nowhere snatch ice cream run away.Happy National Coffee Day everyone !
312,2,2,"The bad McDonald 's I 've ever . Service slow , seem rob lot new worker . really blow away manager ( Stephanie ) come rag like mad woman yell scream top lung threaten send worker home home yelling 5 year old . She 's unprofessional manager . There 's many way get employee work faster ."
311,2,2,Showed 3am close . Went bar ... Came back around 5am ... still close . The bald head manager come tell us close soon I start record open . The woman register extremely rude disgusting . The manager cashier start argue open . `` Why ? `` Is keep ask . Ummm ... excuse ... n't location 24/7 ? ? If n't want money location let know I 'll never come back n't shitty people come respectfully want good service . I could believe level customer service location . It really horrible cashier really disgust unprofessional person . It outrageous way speak customer treat . I believe someone unprofessional nasty .
313,1,1,"Not fast McDonalds , one busy ! If like McDonalds extra crispy , go . Those nugget extra dark edible . I 'll go plenty time I 'm neighborhood ."
314,2,2,"This place sketchy chaotic . I come 8am guy start tantrum yell `` F * CK YOU LET ME USE THE BATHROOM `` two cop show . The cashier look like hate life serve unpleasant face expression . In fact , cashier get piss I n't hear first time tell food ready . I specifically ask 6 cream side coffee , put like one cream think good enough . At least free wi-fi good enough use write review crappy place . If want sort decent food service try many restaurant within half mile mcdonalds ."
315,2,2,"More employee need especially early AM . No matter early get , always make late work . McDonald 's make enough money hire people . MADHOUSE ! `` This ridiculous ..."
316,2,3,"go midnight , food fresh throw chicken sandwich .. past week clean oil cook fry ! black stuff fry look like black pepper 's old grease ! ( whole week nasty stuff ) guess cue eat late stop eat mcdonald 's period"
318,2,2,"First time Brooklyn area , McDonald 's employee nasty customer . I eat want use restroom 's lock , I ask tell customer . This get ridiculous , I customer , I ca n't use restroom . Very poor service , need retrain people treat customer . If like nasty attitude want go McDonald 's Brooklyn 's area . NOT ME !"
319,2,2,One word : Dirty !
320,1,3,"I embarrass admit , I go McDonalds 3 time one day .. Thanksgiving . Twice 2 hour specific location . I already feel judgement probably think would I ever order pescatarian ? ! I wonderful thanksgiving dinner , miss dessert . As imagine could n't find bakery open nearby . I EXTREME sweet tooth I determine . After drink generous amount wine , partner I stumble McDonalds . We thrill location touchscreen could order/ pay .. No line & human interaction = millennials dream . We order usual dessert never fail : vanilla soft serve icecream , Oreo McFlurry , soda , chocolate chip cookie . Buzzed feel adventurous want try apple pie . I always HATED apple pie refuse touch , character . Let tell .. apple pie crumble top soft serve vanilla ice cream cup game changer . It good I go back order another hour I finish dessert . My second visit I notice snicker doodle mcflurry I swear n't option hour touch screen . I order snack size version , find sweet even . Would n't get . Also , chocolate chip cookie hard rock , would normally subtract star . However , new dessert combination game changer life forever change good thanks experience . Thank later . Also McDonalds open 24/7 super nice employee n't even publicly shame come back less 1 hour ! !"
321,3,3,"I give spot 3 star I n't like location . The food serve us incorrect . I understand mistake happen . When show order burger mean n't order hot cakes.Granted n't clerk fault rude . So , I 'll never visit location . I like fact place clean fast food chain . The customer service completely kind ."
322,1,1,I come year yesterday snack take train ride home . It aas rather empty bit 5 . I order 2 chicken tender small order French fry . I ask kind sauce I want . I ask sweet sour sauce.My food ready relatively quickly . I never tender I waz glad n't look small . It go great sweet sour sauce . So French fry actually .
323,3,3,"I use come kid parent I use full homeless people ask money . For , kid , I kind scared random people would come ask money . As I grow I learn understand I felt like location overload people ask money make ruckus location . Their food average never place sit would always take go . The thing I would recommend try control amount loitering ."
324,2,2,"This location n't best , especially night . It 's much unruly-homeless people/people yelling . The nugget soggy miss golden crisp I love . Got fresh batch French fry somehow soggy ! Wish crisp like I remember !"
325,2,3,"Sadly branch serve less quality burger branch .. I use order fillet fish burger often mc Donald store I experience get , get trauma . Sooo dry hardly sauce . The plain mc chicken patty really good branch , 's peppery could barely find lettuce .. disappointed .. hope see review improve .. I like new place though .. organize clean .."
326,2,2,"SMH ! ! ! ! ! ! On Wednesday , June 5 , 2019 , 11:20-11 : 50 I meet one friend . I order meal debit card , sit toddler son , ate . Afterward , I dump garbage walk restroom entrance . I notice door buzz open turn towards register area try get attention female Hispanic Latina employee ladder . ALL I ASKED HER WAS , `` Could I use bathroom ? `` Miss THANG AUDACITY look say , `` Ca n't see I 'm ladder ? `` WHOA ! ! ! ! I shock ! ! ! ! I walk back counter ask problem I ask could I use bathroom . Another female Hispanic Latina laugh say nerve tell go ahead use . Then others come try tell I notice manager happen . I call ask wrong . She try minimize problem I remind PAYING customer ! ! ! ! ! ! ! SMH ! ! ! ! Laughing ? ? ? ? All nasty behind call someone hit buzzer behind counter MOUTH ! ! ! ! DUHHHHHHHHHHH ! ! ! ! ! ! ! ! ! Customers reason even get paycheck ! ! ! ! Never bite hand feed ! ! ! !"
327,1,1,I 'm bit health nut I try go McDonald 's I help however son love chicken nugget 's affordable 're rush n't option hurry I ca n't say food delicious thing good delicious however healthy option chicken salad smoothy mango strawberry fruit smoothy well I love deer ice hazelnut coffee 's affordable 's delicious Starbucks Dunkin donut well
328,2,2,"The service bad , da bad McDonald 's I go , lady wear grey shirt polite look work hard n't know , customer service , blue shirt lady kind nice , grey shirt kind mean"
329,2,2,"This location bad . The food always cold everytime I 've order chicken nugget check return today different . I order food return nugget cold . The guy tell make 're hot . I say NO ! The box hot y'all keep empty box oven feel though food hot open 're old cold . He go speak coworker spanish nugget . So ask sayin say food , feelong xtra . If stop sneaky could great location"
330,2,3,Lot homeless people hang . The place extremely slow place dingy
331,2,2,"After customer , would let use restroom . Their excuse ? `` A truck unload , , restroom service.I truck unloads bathroom !"
332,2,2,This bad manage McDonald 's planet . It reason people hate McDonald 's .
334,2,2,"This place horrible . It deserve 0 star , unfortunately Yelp offer option . I get horrible food poison eat need hospitalize . The management extremely unresponsive issue . Additionally , location dirty ( allow dog inside ) , loud , rowdy . By eat definitely risk health wellbeing . DO NOT COME HERE ."
335,2,2,"This McDonald 's neighborhood year unfortunately , gotten bad time pass . The food average take forever make , even person wait serve . I would definitely avoid McDonald 's cost ."
336,3,2,Very slow service people r wait food . Other usual Mack lover . Hope grow service .
337,2,2,"I live around area I 'm really hungry late hour I come . Also , I get coffee $ 1 . Basically bad customer service history . People work look depressed sleepy . Or look angry life make work . Either way , wait line awhile bum background ask people change ."
338,2,3,"Food rarely fresh , never get good tasting fry McDonald 's . What I think I like delivery option location carry . Do n't mistake , come smushed , cold steam ( late ) . If time , walk 3rd avenue location ."
343,1,2,"Stopped pick pokemon happy meal apparently 're sell playing card Pikachu box McDonalds location New York City . They lot leave , quick process order pick . Had issue customer service order either ."
344,3,3,"For McDonald 's standard , 's ok. Not bad , could well . Service speed ok location look fairly clean updated . I get McGriddle sausage McMuffin egg . The McGriddle dry . The McMuffin 's English muffin dry tad stale . I also find egg shell egg . I almost cut gum . On bright side least I know use real whole egg ."
345,3,3,"Alright location , yellow line 6 train n't far walk . Quite table seat . One gender neutral washroom downstairs decent size mirror , bit wet floor 's alright , quite toilet paper floor . Definitely bad I 've see surely clean least smell clean . Staff n't friendly kind cold n't rude either . There 's second floor close chair table organize late hour ."
346,2,2,"The phone hook McDonald 's phone order order hook duck u , fuck u , fuck u , fuck u , long enough ?"
347,2,2,"This terrible McDonald 's experience , kiosk n't work correctly , table n't clean , chair material rip expose , top food old cold , milkshake warm . The facility clog disgust , customer service subpar . At least nice , even n't helpful . I may never come ."
348,3,3,"This McDonalds OK - much good one West 4th term sof customer service efficiency . The interior pretty clean lot seat low level . The upper level use open time recent visit , I 've notice close . I guess make sense save cleaning . One thing annoy customer form one line center get yell form 2 line . This make NO sense often time , line choose 2 , end behind someone slow frustratingly watch people arrive line order even . Just let us make 1 line everyone fairly serve base get line . Overall pretty standard McDonald 's area regular menu item ability use physical coupon coupon mobile app ."
349,3,3,"This super busy McDonalds . I appreciate keep quality despite one Manhattan location n't touchscreen yet . They need bathroom , touchscreen order , customer-filled fountain drink , seating . The seating issue could fix leave second floor din area open time , would n't accessible people wheelchair . Somehow guy stay friendly keep food fresh despite pressure ."
350,2,2,"Man , I 'm expect much McD extra bad . I order nothing small fry , wait 10-15 min ... I ask lot sooner , point I ask : 's go fry ? The lady say ( direct quote ) `` n't say something ? `` And start cook fry moment , literally 15 minute I ordered.Unreal . At point I walk lose $ 2.09 ."
351,2,2,"This bad experience I ever fast food restaurant . Our order take incorrectly , realize cashier argue back want order us actually want . Once receive food , breakfast sausage burnt chicken tender miss . Needed use bathroom toilet paper disgust . Security guard would allow use bathroom . I appal customer I deny . Would never go back ."
352,1,1,"This mcdonald 's particular one best NYC area , freshly fry nugget , bite salty , crunchy juicy delight ."
353,1,2,"I walk downtown McDonald 's Friday evening find usual scene : couple grab quick bite , teenager get ready night town , dead man sit booth window.I get line , go fairly quickly , order ten piece McNugget meal fry Dr. Pepper . After cashier take order , I say , `` know , 's none business , 's dead guy booth . `` She star blankly hand receipt.As I wait order , I wander dead man 's booth confirm indeed cold , lifeless body . I decide give name : Gene . Gene 's final meal spread table front : medium fry , soda , ten piece McNuggets barbecue sauce . I go back counter pick meal . `` You want barbecue sauce ? `` I pause . `` No thanks , `` I say . `` Better go honey mustard . `` I sit empty table eat meal . The bright , fluorescent light give place sterile , industrial feel . A top 40 playlist croon loudspeaker . After minute , Gene 's fester corpse fell upright position collapse booth next . It fairly busy night , I count dozen people come go eat nugget . I one leave young woman enter . She walk past Gene 's body , double take . A look confusion swept across face . She scan room nervously , lock eye . For brief second , become member dark conspiracy . In 's eye , gaze grey abyss existence . She nod silently . I pick tray , leave McDonald 's . Overall , pretty standard McDonald 's . Clean bathroom . Make sure ask ketchup , n't give unless ask ."
354,2,2,"UGH .... This place get bad bad everytime I come . # 3 ( Double Quarter Pounder Cheese ) Pickles , Coke.IS THAT SO FUCKING HARD ? write onion . What I get ? A chicken sandwich.It say right TAG print , ON THE BOX.Seriously , guy want raise ? Fucking graduate High School first ."
355,2,2,I go buy bacon egg & cheese biscuit meal go . Of course I get work biscuit hard I could n't bite sandwich . I eat bacon egg & cheese alone . I know 's fast food make food edible . Not go back McDonald 's ! ! !
356,2,2,The manager rude . I ask question rude response . Then proceed scream `` yo `` . He rude I come back ever .
357,2,2,"One person , breakfast , first time buying restaurant . Take . No wait.Another day , another mickie D 's review . This one even bad last time albeit I best condition healthily . Sick , I buy big breakfast hot cake . Asked latter cashier give demeaning , condescend answer , say ? This touristy part town , miss , I n't exactly look like I belong , I ? I come back office eat hot , nice smell come nose . Except I hang keep throw n't eat till lunch . By , hash brown cold warm , I give crispness . Everything bland , even sausage . Pancakes/hot cake okay though . Two star . Apple pay accept yay !"
359,2,2,"This review may sound really dramatic , 's accurately I put . One thing keep mind , though , I go around 1am . So I might refer late service . This McDonald 's bad McDonald 's I ever , anywhere entire world . The service awful food even bad . Firstly 's mess physically ( n't uncommon NYC , though ) food splatter floor , unwiped table , etc . Secondly , waitress/lady cashier literally yell us come order keep mind previous person finish ordering literally yell `` NEXT NEXT NEXT `` condoning way suggest hand need hurry . Completely unnecessary almost empty 's 24 hour McDonald 's . Anyways , order one friend even forget order one item much pressure waitress put order n't give us receipt AND almost skip friend behind us rush ... At point I think okay , food make . I mean .. 's MCDONALD 'S , antidote bad situation . Boy I wrong , soon I put one fry mouth I know game . It literally taste like reheat microwave cold hour , I say experience . I could barely get fry throat , best believe I touch fry first one . The burger awful accord friend , I ca n't speak far . The chicken nugget , catastrophe . They hard yet soft quite hard bite yet really damp chewy . Honestly disgust . McNuggets suppose great , make hate ."
360,3,2,"Open late , cheap especially app ! They n't fry though time , breakfast item take least 15 minute"
361,2,1,"The credit card machine always work . It 's always cash . No matter much complain , nothing change . Unbelievable ! !"
362,2,2,"This place SO slow . Employees major attitude . Last time I order food , either forget call number , possibly , call number I n't hear , let food sit counter long time never try call number . Eventually I ask food counter number , say `` I dunno ? `` , expect thumb order . Fortunately mine , otherwise I would put hand someone 's food . Only reason n't one star n't nightmare experience anything , generally unpleasant slow ."
